School,School,State,join_id,operation_dates,religions_identified,tribes_identified,DOI deceased,WP deceased,DOI burial sites,WP burial sites,other_names,Latitude,Longitude,Verified
Chemawa Indian Training School,[Chemawa Indian Training School](https://github.com/washingtonpost/data-boarding-schools/tree/main/schools/OR/Chemawa_Indian_Training_School),OR,352,1880 - Open,,"Alaskan; Aleut, Unangan; Alsea Yaquina from Siletz; Arapaho, Arapahoe; Arikara, Arickaree, Arikaree; Assiniboine; Bannock, Northern Paiute; Blackfeet, Blackfoot; Cayuse, Liksiyu; Chehalis; Chelan from Colville; Cherokee; Cheyenne; Cheyenne RiverSioux; Chippewa; Chippewa from Rocky Boys, Montana; Coeur D'Alene; Colville; Colville from Colville; Coos; Coquille, Ko-Kwel; Cowlitz; Cree; Creek, Muscogee, Mvskoke; Crow Creek Sioux; Crow, Absaroka; Digger Indian; Eskimo; Flathead Indians; Grand Ronde Tribes, Oregon; Gros Ventre, Aaniiih; Haida; Hupa, Hoopa; Kalispel; Karuk; Klamath; Klikitat; Leech Lake Band Chippewa, Minnesota; Little Lake; Lower Chinook from Siletz; Lummi; Makah, Ozette Makah; Modoc from Klamath, Oregon; Muckleshoot; Navajo, Navaho, Dine; Nez Perce, Idaho; Nisqually, Nisqualli; Nooksack; Northern Paiute from Warm Springs; Oneida; Paiute, Pi-Ute; Piegan, Peigan, Pikuni, Piikuni; Pit River; Pomo; Puyallup; Quileute; Quinault, Quinaielt; Redwood Valley, Pomo; Rogue River Indians; Rosebud Sioux; Samish; Shasta; Shoshone, Shoshoni, Snake; Sioux; Sisseton Wahpeton Oyate Sioux; Skagit; S'klallam, Klallam, Clallam; Skokomish; Snohomish; Snoqualmie; Spokane; Spokane from Coeur d'Alene; Standing Rock Sioux; Steilacoom; Suquamish; Swinomish; Three Affiliated Tribes of Fort Berthold, Mandan, Hidatsa, Arikara; Tilamook, Nekelim, Siletz; Tlingit, Tlinkit; Tolowa Dee-ni', Smith River; Tsimshian; Tulalip; Turtle Mountain Band of Chippewa; Umatilla; Umpqua; Ute; Walla Walla, Wallawalla; Wasco, Wishram; Washoe, Washo; White Earth Band Chippewa; Wintun, Wintoon; Yakama, Yakima",53,268,1 onsite,,"Salem Indian School; United States Indian Training and Normal School; Salem Indian
Industrial and Training School; Harrison Institute; Chemawa Indian School*",45.00124103,-122.9867162,TRUE
Carlisle Indian Industrial School,[Carlisle Indian Industrial School](https://github.com/washingtonpost/data-boarding-schools/tree/main/schools/PA/Carlisle_Indian_Industrial_School),PA,360,1879 - 1918,,"Alaskan; Aleut, Unangan; Apache; Arapaho, Arapahoe; Arikara, Arickaree, Arikaree; Assiniboine; Bannock, Northern Paiute; Blackfeet, Blackfoot; Caddo; Catawba, Issa, Essa, Iswa; Cayuga; Cayuse, Liksiyu; Cherokee; Cheyenne; Chickasaw, Chikashsha; Chippewa; Chiricahua Apache; Chitimacha; Choctaw; Coeur D'Alene; Colville; Comanche; Creek, Muscogee, Mvskoke; Crow, Absaroka; Delaware, Lenni Lenape; Digger Indian; Eastern Cherokee, North Carolina; Eskimo; Flathead Indians; Fort Sill Apache; Gros Ventre, Aaniiih; Haudenosaunee, Iroquois Confederacy, Six Nations; Ho-Chunk, Winnebago; Hopi, Moqui Pueblo; Hupa, Hoopa; Iowa, Ioway, Bah-Kho-Je, Baxoje; Kaibab Band of Paiute; Keres, Queres Pueblo; Kickapoo, Kiikaapoa, Kiikaapoi; Kiowa; Klamath; Kootenai, Ktunaxa, Kutenai, Kootenay, Ksanka; Lipan Apache; Lower Brule Sioux; Luiseno; Lummi; Mandan, Mantannes, Mayadana; Mashpee Wampanoag; Menominee, Menomini, Mamaceqtaw; Miami; Michigan Chippewa; Minnesota Chippewa; Mission Indians, California; Modoc; Mohawk, Kanien'keha:ka; Mooretown; Morongo Band of Mission Indians; Munsee, Muncee, Minsi; Narragansett; Navajo, Navaho, Dine; Nez Perce; Nez Perce, Idaho; Nooksack; Northern Arapaho from Wind River, Wyoming; Oglala Sioux from Pine Ridge; Okanagan from Colville; Omaha; Oneida; Oneida, Wisconsin; Onondaga; Osage; Ottawa, Odawa, Odaawaa; Paiute, Pi-Ute; Pamunkey; Pawnee; Pend d'Oreille, Upper Kalispel; Penobscot, Maine; Peoria; Piegan, Peigan, Pikuni, Piikuni; Pima; Pit River; Ponca; Potawatomi, Potawatomie, Pottawatomie, Potowatomi; Pueblo; Pueblo of Acoma, Haak'u; Pueblo of Cochiti, KO-TYIT; Pueblo of Laguna, Ka'waika; Pueblo of Zuni, Ashiwi; Puyallup; Quapaw; Sac and Fox; Sac and Fox of Oklahoma; Saint Regis, St Regis Band of Mohawk; San Carlos Apache; San Poil from Colville; Seminole; Seneca; Seneca-Cayuga Nation, Oklahoma; Shawnee; Shoshone, Shoshoni, Snake; Sioux; Sisseton Wahpeton Oyate Sioux; S'klallam, Klallam, Clallam; Spokane; Stockbridge-Munsee, Stockbridge Mohican; Tlingit, Tlinkit; Tonawanda Band of Seneca; Tonto Apache; Tuscarora; Umatilla; Umpqua; Ute; Wabanaki, Wabenaki, Wobanaki; Warm Springs Apache, Chihennes; Washoe, Washo; Wichita, Kitikiti'sh; Wyandot, Wyandotte; Yakama, Yakima; Yankton Sioux, Yanktonai",189,232,1 onsite,4 offsite,Carlisle Training School,40.208424,-77.178144,TRUE
Haskell Indian Industrial Training School,[Haskell Indian Industrial Training School](https://github.com/washingtonpost/data-boarding-schools/tree/main/schools/KS/Haskell_Indian_Industrial_Training_School),KS,128,1884 - Open,,"Apache; Arapaho, Arapahoe; Arikara, Arickaree, Arikaree; Assiniboine; Bannock, Northern Paiute; Blackfeet, Blackfoot; Bois Forte Band Chippewa, Nett Lake, Minnesota; Caddo; Catawba, Issa, Essa, Iswa; Cayuga; Cayuse, Liksiyu; Cherokee; Cherokee of Oklahoma, Cherokee Nation; Cheyenne; Cheyenne River Sioux; Chickasaw, Chikashsha; Chippewa; Choctaw; Choctaw of Oklahoma, Choctaw Nation; Colville from Colville; Comanche; Creek, Muscogee, Mvskoke; Crow Creek Sioux; Crow, Absaroka; Delaware, Lenni Lenape; Digger Indian; Eastern Cherokee, North Carolina; Flandreau Santee Sioux; Flathead Indians; Fond du Lac Band Chippewa, Minnesota; Grand Portage Band Chippewa, Minnesota; Gros Ventre, Aaniiih; Havasupai, Yava Supai; Ho-Chunk, Winnebago; Ho-Chunk, Winnebago, Wisconsin; Hopi, Moqui Pueblo; Hualapai; Hupa, Hoopa; Iowa, Ioway, Bah-Kho-Je, Baxoje; Kaw, Kansa, Kanza, Kanzas, Kansas; Kickapoo, Kiikaapoa, Kiikaapoi; Kiowa; Klamath; Leech Lake Band Chippewa, Minnesota; Lummi; Maricopa; Menominee, Menomini, Mamaceqtaw; Mission Indians, California; Mississippi Band of Choctaw; Mohave, Mojave; Mohawk, Kanien'keha:ka; Muckleshoot; Munsee, Muncee, Minsi; Navajo, Navaho, Dine; Nez Perce, Idaho; Nisqually, Nisqualli; Okanagan from Colville; Omaha; Oneida; Osage; Otoe; Ottawa, Odawa, Odaawaa; Paiute, Pi-Ute; Pawnee; Peoria; Piegan, Peigan, Pikuni, Piikuni; Pima; Pomo; Ponca; Potawatomi, Potawatomie, Pottawatomie, Potowatomi; Pueblo; Pueblo of Zuni, Ashiwi; Puyallup; Quapaw; Quechan, Yuma; Rogue River Indians; Sac and Fox; Seminole; Seneca; Shawnee; Shoshone, Shoshoni, Snake; Sioux; Snohomish; Stockbridge- Munsee, Stockbridge Mohican; Tohono O'odham, Papago; Tonkawa, Oklahoma; Turtle Mountain Band of Chippewa; Umatilla; Ute; Wabanaki, Wabenaki, Wobanaki; Washoe, Washo; White Earth Band Chippewa; Wichita, Kitikiti'sh; Wyandot, Wyandotte; Yakama, Yakima; Yuchi, Euchee",23,146,2 onsite,,"United States Indian Industrial Training School; Haskell Junior College; Haskell Institute;
Haskell Indian Nations University*",38.93972222,-95.23277778,TRUE
Fort Hall Boarding School,[Fort Hall Boarding School](https://github.com/washingtonpost/data-boarding-schools/tree/main/schools/ID/Fort_Hall_Boarding_School),ID,110,1874 - 1936,,"Assiniboine; Bannock, Northern Paiute; Chippewa; Chippewa from Rocky Boys, Montana; Cree from Rocky Boys, Montana; Crow Creek Sioux; Mohave, Mojave; Paiute Shoshone; Paiute, Pi-Ute; Piegan, Peigan, Pikuni, Piikuni; Pueblo; Rosebud Sioux; Shoshone Bannock; Shoshone, Shoshoni, Snake; Shoshone, Te-Moak, Wells Colony; Sioux",15,110,,1 offsite,Lincoln Creek Boarding School,43.01285009,-112.4314679,TRUE
"Sherman Institute: Riverside, CA",[Sherman Institute](https://github.com/washingtonpost/data-boarding-schools/tree/main/schools/CA/Sherman_Institute),CA,78,1902 - Open,,"Alaskan; Apache; Arapaho, Arapahoe; Arikara, Arickaree, Arikaree; Assiniboine; Atsugewi, Hat Creek; Bannock, Northern Paiute; Blue Lake Rancheria of the Wiyot, Yurok, Hupa; Cachil DeHe Band of Wintun Indians, Colusa; Cahto, Kato; Cayuse, Liksiyu; Chemehuevi from Colorado River; Cherokee; Cheyenne; Chickasaw, Chikashsha; Chippewa; Choctaw; Choctaw of Oklahoma, Choctaw Nation; Chukchansi; Chumash; Cocopah, Kwapa; Colville; Comanche; Creek, Muscogee, Mvskoke; Crow Creek Sioux; Crow, Absaroka; Digger Indian; Eel River, Lassik, Wailaki; Flathead Indians; Fort Bidwell Paiute; Fort Sill Apache; Goshute, Deer Creek, Snake Creek, Newe, Newenee, Shoshone; Havasupai, Yava Supai; Ho-Chunk, Winnebago; Hopi, Moqui Pueblo; Hualapai; Hupa, Hoopa; Karuk; Kashia, Stewarts Point, Pomo; Klamath; Little Lake; Lummi; Makah, Ozette Makah; Maricopa; Me-wuk, Miwok; Mission Indians, California; Modoc from Klamath, Oregon; Mohave from Colorado River; Mohave, Mojave; Mohawk, Kanien’keha:ka; Mono; Mooretown; Navajo, Navaho, Dine; Nez Perce, Idaho; Nisqually, Nisqualli; Oneida; Ottawa, Odawa, Odaawaa; Paiute Shoshone; Paiute, Pi-Ute; Pascua Yaqui; Patwin, Solano; Pawnee; Pima; Pit River; Pomo; Pueblo; Pueblo of Isleta, Tue-I; Pueblo of Laguna, Ka'waika; Pueblo of Zuni, Ashiwi; Quapaw; Quechan, Yuma; Quinault, Quinaielt; Redwood Valley, Pomo; Rosebud Sioux; Round Valley; Sac and Fox; San Carlos Apache; Santa Rosa Rancheria, Tachi Yokut; Seneca; Shasta; Shoshone, Shoshoni, Snake; Shoshone, Te-Moak, Elko Colony; Sioux; S'klallam, Klallam, Clallam; Southern Ute; Spokane; Standing Rock Sioux; Suquamish; Tejon; Tlingit, Tlinkit; Tohono O'odham, Papago; Tolowa Dee-ni', Smith River; Tubatulabal, Kern River Valley; Tule River; Tuolumne; Turtle Mountain Band of Chippewa; Umatilla; Ute; Ute Indian Tribe of the Uintah and Ouray; Walker River Paiute, Nevada; Wappo; Wasco, Wishram, Chinook from Warm Springs; Washoe, Washo; White Earth Band Chippewa; Wintun, Wintoon; Wukchumni, Yokuts; Yakama, Yakima; Yankton Sioux, Yanktonai; Yokut, Mariposan; Yukiah, Yuki, Ukiah; Yurok",28,100,1 onsite,,Riverside School; Sherman Indian High School*; Harwood Hall,33.92324939,-117.4371059,TRUE
Mount Pleasant Indian Industrial Boarding School,[Mount Pleasant Indian Industrial Boarding School](https://github.com/washingtonpost/data-boarding-schools/tree/main/schools/MI/Mount_Pleasant_Indian_Industrial_Boarding_School),MI,140,1893 - 1934,,"Cherokee; Chippewa; Fond du Lac Band Chippewa, Minnesota; Haudenosaunee, Iroquois Confederacy, Six Nations; Menominee, Menomini, Mamaceqtaw; Oneida; Ottawa, Odawa, Odaawaa; Potawatomi, Potawatomie, Pottawatomie, Potowatomi; Seneca",1,96,"1 offsite, 1 onsite",1 offsite,"Michigan Indian Industrial Boarding School; Mount Pleasant Indian School; Mount Pleasant
Training",43.614285,-84.789523,TRUE
Albuquerque Indian School,[Albuquerque Indian School](https://github.com/washingtonpost/data-boarding-schools/tree/main/schools/NM/Albuquerque_Indian_School),NM,237,1882 - 1982,Presbyterian Board of Home Missions,"Apache; Chemehuevi, Chimehuevi Pauite; Cherokee; Chippewa; Choctaw; Comanche; Creek, Muscogee, Mvskoke; Flathead Indians; Havasupai, Yava Supai; Hopi, Moqui Pueblo; Klamath; Mescalero Apache; Mission Indians, California; Modoc; Mohave, Mojave; Navajo, Navaho, Dine; Oneida; Pima; Potawatomi, Potawatomie, Pottawatomie, Potowatomi; Pueblo; Pueblo of Acoma, Haak'u; Pueblo of Cochiti, KO-TYIT; Pueblo of Isleta, Tue-I; Pueblo of Jemez, Walatowa; Pueblo of Laguna, Ka'waika; Pueblo of San Felipe, Katishtya; Pueblo of San Juan, Ohkay Owingeh; Pueblo of Sandia, NA-FIAT; Pueblo of Santa Clara, Kah'p'oo Owinge; Pueblo of Santo Domingo; Pueblo of Taos, Tuah-Tah; Pueblo of Tesuque, TET-SUGEH; Pueblo of Zia, Tsi-ya; Pueblo of Zuni, Ashiwi; Quechan, Yuma; Sac and Fox; Seneca; Shawnee; Sioux; Southern Ute; Tohono O'odham, Papago; Ute",10,77,"1 offsite, 1 onsite",1 offsite,"Indian Pueblo Training School; Fisk Institute; Fiske Institute; Albuquerque Industrial
Boarding School; Albuquerque Training School; Albuquerque Boarding School",35.110016524895 ; 35.11000869457,-106.6706375393 ; -106.65901143343,TRUE
Fort Defiance Boarding School,[Fort Defiance Boarding School](https://github.com/washingtonpost/data-boarding-schools/tree/main/schools/AZ/Fort_Defiance_Boarding_School),AZ,30,1881 - 1959,Christian Reformed Church; Presbyterian Board of Home Missions,"Hopi, Moqui Pueblo; Navajo, Navaho, Dine; Paiute, Pi-Ute; Pueblo; Ramah Navajo",13,69,,1 offsite,"Navajo Indian Boarding School; Navajo Agency Boarding School; Navajo Industrial School;
Navajo Training School; Navajo Agency School; Southern Navajo School",35.75293,-109.0812022,TRUE
Stewart Indian Boarding School,[Stewart Indian Boarding School](https://github.com/washingtonpost/data-boarding-schools/tree/main/schools/NV/Stewart_Indian_Boarding_School),NV,201,1890 - 1980,,"Alaskan; Apache; Cahto, Kato; Cherokee; Chippewa; Chippewa from Rocky Boys, Montana; Chukchansi; Cowlitz; Cree from Rocky Boys, Montana; Digger Indian; Eel River, Lassik, Wailaki; Fallon Paiute Shoshone; Flathead Indians; Fond du Lac Band Chippewa, Minnesota; Goshute, Deer Creek, Snake Creek, Newe, Newenee, Shoshone; Hopi, Moqui Pueblo; Hupa, Hoopa; Klamath; Klikitat; Me-wuk, Miwok; Modoc from Klamath, Oregon; Molala, Molale, Molele, Molalie; Mono; Mooretown; Nez Perce, Idaho; Nooksack; Paiute from Warm Springs; Paiute Shoshone; Paiute, Pi-Ute; Pit River; Pomo; Pueblo; Pyramid Lake Paiute; Quartz Valley, Klamath, Karuk, Shasta; Round Valley; Shoshone Bannock; Shoshone, Shoshoni, Snake; Shoshone, Te-Moak, Elko Colony; Sioux; Sisseton Wahpeton Oyate Sioux; Snohomish; Tlingit, Tlinkit; Tule River; Umatilla; Ute; Walker River Paiute, Nevada; Washoe, Washo; Yukiah, Yuki, Ukiah; Yurok",21,58,"1 offsite, 1 onsite",,Stewart Institute; Carson School; Carson Industrial School,39.117337,-119.760051,TRUE
Genoa Indian Industrial School,[Genoa Indian Industrial School](https://github.com/washingtonpost/data-boarding-schools/tree/main/schools/NE/Genoa_Indian_Industrial_School),NE,192,1884 - 1934,,"Cheyenne; Cheyenne River Sioux; Chippewa; Crow, Absaroka; Flandreau Santee Sioux; Ho-Chunk, Winnebago; Kickapoo, Kiikaapoa, Kiikaapoi; Leech Lake Band Chippewa, Minnesota; Lower Brule Sioux; Omaha; Osage; Ottawa, Odawa, Odaawaa; Piegan, Peigan, Pikuni, Piikuni; Ponca; Ponca of Nebraska; Potawatomi, Potawatomie, Pottawatomie, Potowatomi; Rosebud Sioux; Sac and Fox; Shoshone, Shoshoni, Snake; Sioux; White Earth Band Chippewa",16,54,1 onsite,,Genoa Manual Training; Genoa Day School; Grant Institute,41.44982487,-97.72413475,TRUE
Chilocco Indian Agricultural School,[Chilocco Indian Agricultural School](https://github.com/washingtonpost/data-boarding-schools/tree/main/schools/OK/Chilocco_Indian_Agricultural_School),OK,301,1884 - 1980,,"Alaskan; Apache; Arapaho, Arapahoe; Arikara, Arickaree, Arikaree; Assiniboine; Blackfeet, Blackfoot; Caddo; Cherokee; Cheyenne; Chickasaw, Chikashsha; Chippewa; Choctaw; Comanche; Creek, Muscogee, Mvskoke; Delaware, Lenni Lenape; Digger Indian; Eastern Cherokee, North Carolina; Gros Ventre, Aaniiih; Haudenosaunee, Iroquois Confederacy, Six Nations; Ho-Chunk, Winnebago; Hopi, Moqui Pueblo; Hualapai; Iowa, Ioway, Bah-Kho-Je, Baxoje; Kaw, Kansa, Kanza, Kanzas, Kansas; Kickapoo, Kiikaapoa, Kiikaapoi; Kiowa; Kiowa Apache, Plains Apache; Klamath; Leech Lake Band Chippewa, Minnesota; Menominee, Menomini, Mamaceqtaw; Miami of Oklahoma; Mississippi Band of Choctaw; Modoc, Oklahoma; Mohave, Mojave; Munsee, Muncee, Minsi; Navajo, Navaho, Dine; Nez Perce, Idaho; Northern Cheyenne, Montana; Omaha; Oneida; Osage; Otoe; Ottawa, Odawa, Odaawaa; Pawnee; Peoria; Pima; Pit River; Ponca; Potawatomi, Potawatomie, Pottawatomie, Potowatomi; Pueblo; Quapaw; Quechan, Yuma; Sac and Fox; Seminole; Seneca; Shawnee; Sioux; Tohono O'odham, Papago; Tonkawa, Oklahoma; Wichita, Kitikiti'sh; Wyandot, Wyandotte; Yuchi, Euchee",10,50,1 onsite,,"Hayworth Institute; Chilocco Indian Industrial School; Chilocco Indian Agricultural School;
Chilocco Indian School; Chilocco Training",36.98747222,-97.07013889,TRUE
Santa Fe Indian School*,[Santa Fe Indian School*](https://github.com/washingtonpost/data-boarding-schools/tree/main/schools/NM/Santa_Fe_Indian_School),NM,235,1890 - Open,,"Apache; Assiniboine; Chippewa; Crow Creek Sioux; Gila River - Sacaton; Ho-Chunk, Winnebago; Hopi, Moqui Pueblo; Jicarilla Apache; Klamath; Manchester, Pomo; Mescalero Apache; Mohave, Mojave; Navajo, Navaho, Dine; Pascua Yaqui; Pawnee; Peoria; Pima; Pomo; Pueblo; Pueblo of Picuris, Pe'ewi; Pueblo of San Juan, Ohkay Owingeh; Pueblo of Santo Domingo; Pueblo of Taos, Tuah-Tah; Pueblo of Zia, Tsi-ya; Pueblo of Zuni, Ashiwi; Puyallup; Sac and Fox; San Carlos Apache; Shoshone, Shoshoni, Snake; Shoshone, Te-Moak, Elko Colony; Southern Ute; Tohono O'odham, Papago; Ute; Watlala, Cascade Indians; White Mountain Apache; Yukiah, Yuki, Ukiah",34,48,1 onsite,,"Dawes Institute; Santa Fe Industrial Training School; Santa Fe Indian Industrial School; Santa
Fe Training School",35.67127778,-105.9670556,TRUE
Phoenix Indian School,[Phoenix Indian School](https://github.com/washingtonpost/data-boarding-schools/tree/main/schools/AZ/Phoenix_Indian_School),AZ,73,1891 - 1990,,"Apache; Bannock, Northern Paiute; Blackfeet, Blackfoot; Caddo; Chemehuevi from Colorado River; Cherokee; Cheyenne River Sioux; Chickasaw, Chikashsha; Chippewa; Choctaw; Cocopah, Kwapa; Comanche; Cree; Creek, Muscogee, Mvskoke; Crow, Absaroka; Digger Indian; Gila River - Pima; Havasupai, Yava Supai; Ho-Chunk, Winnebago; Ho-Chunk, Winnebago, Nebraska; Hopi from Colorado River; Hopi, Moqui Pueblo; Hualapai; Hupa, Hoopa; Kiowa; Kiowa Apache, Plains Apache; Klamath; Lac du Flambeau Band, Lake Superior Chippewa; Maricopa; Mescalero Apache; Mission Indians, California; Modoc from Klamath, Oregon; Mohave from Colorado River; Mohave, Mojave; Nakoda from Fort Peck; Navajo, Navaho, Dine; Nez Perce, Idaho; Osage; Otoe; Paiute Shoshone; Paiute, Pi-Ute; Pawnee; Pima; Ponca; Potawatomi, Potawatomie, Pottawatomie, Potowatomi; Pueblo; Pueblo of Acoma, Haak'u; Pueblo of Zuni, Ashiwi; Quapaw; Quechan, Yuma; Sac and Fox; Salt River Pima; San Carlos Apache; Shawnee; Sioux; Southern Ute; Standing Rock Sioux; Tlingit, Tlinkit; Tohono O'odham, Papago; Turtle Mountain Band of Chippewa; Washoe, Washo; Yakama, Yakima; Yankton Sioux, Yanktonai",23,46,,,"Phoenix Training School; Phoenix Training and Industrial School; Peel Institute; Phoenix
School; Phoenix Sanatorium",33.495828,-112.069402,TRUE
Rapid City Indian School,[Rapid City Indian School](https://github.com/washingtonpost/data-boarding-schools/tree/main/schools/SD/Rapid_City_Indian_School),SD,390,1898 - 1934,,"Arapaho, Arapahoe; Arikara, Arickaree, Arikaree; Assiniboine; Blackfeet, Blackfoot; Cheyenne; Cheyenne River Sioux; Chippewa; Cree; Crow Creek Sioux; Crow, Absaroka; Flandreau Santee Sioux; Flathead Indians; Gros Ventre, Aaniiih; Lower Brule Sioux; Mandan, Mantannes, Mayadana; Northern Cheyenne, Montana; Oglala Sioux from Pine Ridge; Omaha; Rosebud Sioux; Sioux; Sisseton Wahpeton Oyate Sioux; Spokane; Standing Rock Sioux; Three Affiliated Tribes of Fort Berthold, Mandan, Hidatsa, Arikara; Turtle Mountain Band of Chippewa; White Earth Band Chippewa; Yankton Sioux, Yanktonai",12,45,"1 offsite, 1 onsite",,"Rapid City Indian School and Sanatorium; Rapid City Training; School of the Hills; Sioux
Sanatorium; Sioux San Day School; Sioux San Hospital",44.072883,-103.275027,TRUE
Pierre Indian School,[Pierre Indian School](https://github.com/washingtonpost/data-boarding-schools/tree/main/schools/SD/Pierre_Indian_School),SD,379,1890 - Open,,"Arikara, Arickaree, Arikaree; Blackfeet, Blackfoot; Cherokee; Cheyenne River Sioux; Chippewa; Cree from Rocky Boys, Montana; Crow Creek Sioux; Crow, Absaroka; Flandreau Santee Sioux; Flathead Indians; Gros Ventre, Aaniiih; Ho-Chunk, Winnebago; Hopi, Moqui Pueblo; Lower Brule Sioux; Mandan, Mantannes, Mayadana; Nakoda from Fort Belknap; Nakoda from Fort Peck; Nez Perce, Idaho; Northern Cheyenne, Montana; Oglala Sioux from Pine Ridge; Omaha; Piegan, Peigan, Pikuni, Piikuni; Ponca; Rosebud Sioux; Sac and Fox; Santee Sioux; Sioux; Sisseton Wahpeton Oyate Sioux; Standing Rock Sioux; Three Affiliated Tribes of Fort Berthold, Mandan, Hidatsa, Arikara; Turtle Mountain Band of Chippewa; White Earth Band Chippewa; Yankton Sioux, Yanktonai",2,40,,1 offsite,Pierre Indian School Learning Center; Pierre Indian Learning Center*,44.35294613,-100.310645,TRUE
Grand Junction Indian School,[Grand Junction Indian School](https://github.com/washingtonpost/data-boarding-schools/tree/main/schools/CO/Grand_Junction_Indian_School),CO,92,1886 - 1911,,"Apache; Hopi from Colorado River; Hopi, Moqui Pueblo; Navajo, Navaho, Dine; Pima; Pueblo; Shoshone, Shoshoni, Snake; Tohono O'odham, Papago",0,36,1 onsite,,Grand Junction School; Grand Junction Training; Teller Indian School; Teller Institute,39.06457282,-108.5303134,TRUE
St. Labre Indian Mission Boarding School,[St. Labre Indian Mission Boarding School](https://github.com/washingtonpost/data-boarding-schools/tree/main/schools/MT/St_Labre_Indian_Mission_Boarding_School),MT,189,1884 - Open,Catholic Bureau of Indian Missions; Roman Catholic,"Northern Cheyenne, Montana",1,33,,1 onsite,St. Labre at Busby; St. Labre Indian School*,45.60555556,-106.2827778,TRUE
Thomas Indian School,[Thomas Indian School](https://github.com/washingtonpost/data-boarding-schools/tree/main/schools/NY/Thomas_Indian_School),NY,249,1855 - 1969,American Board of Commissioners for Foreign Missions (ABCFM); Religious Society of Friends,"Cayuga; Cayuse, Liksiyu; Mohawk, Kanien'keha:ka; Munsee, Muncee, Minsi; Oneida; Onondaga; Saint Regis, St Regis Band of Mohawk; Seneca; Shinnecock, New York; Tonawanda Band of Seneca; Tuscarora; Wabanaki, Wabenaki, Wobanaki",18,33,1 onsite,1 offsite,Gowanda School; Thomas Asylum of Orphan and Destitute Indian Children,42.53944444,-78.99666667,TRUE
Cushman Indian School,[Cushman Indian School](https://github.com/washingtonpost/data-boarding-schools/tree/main/schools/WA/Cushman_Indian_School),WA,413,1869 - 1930,,"Chehalis; Coeur D'Alene; Humptulip, Coast Salish; Nisqually, Nisqualli; Puyallup; Quaitso; Quinault, Quinaielt; S'klallam, Klallam, Clallam; Skokomish; Squaxin Island, Squaxon",8,33,1 onsite,1 offsite,"Cushman Indian Trades School; Puyallup Indian School; Puyallup Boarding School; Tacoma
Sanatorium; Cushman Indian Hospital; Cascadia",47.26277778,-122.4422222,FALSE
Fort Lapwai Training School,[Fort Lapwai Training School](https://github.com/washingtonpost/data-boarding-schools/tree/main/schools/ID/Fort_Lapwai_Training_School),ID,108,1879 - 1935,,"Alaskan; Arapaho, Arapahoe; Assiniboine; Bannock, Northern Paiute; Blackfeet, Blackfoot; Cayuse, Liksiyu; Cheyenne; Coeur D'Alene; Colville; Colville from Colville; Cree; Digger Indian; Eastern Shoshone from Wind River, Wyoming; Eskimo; Flathead Indians; Gros Ventre, Aaniiih; Kalispel; Klamath; Klamath, Oregon; Kootenai Tribe of Idaho, Idaho Ksanka, Lower Kootenai; Kootenai, Ktunaxa, Kutenai, Kootenay, Ksanka; Lummi; Modoc from Klamath, Oregon; Muckleshoot; Nez Perce from Colville; Nez Perce, Idaho; Nooksack; Northern Arapaho from Wind River, Wyoming; Northern Cheyenne, Montana; Paiute Shoshone; Paiute, Pi-Ute; Piegan, Peigan, Pikuni, Piikuni; Port Madison, Suquamish; Puyallup; Quinault, Quinaielt; Seminole, Oklahoma; Shoshone, Shoshoni, Snake; Sioux; Skagit; S'klallam, Klallam, Clallam; Snohomish; Spokane; Suquamish; Tilamook, Nekelim, Siletz; Tlingit, Tlinkit; Tolowa Dee-ni', Smith River; Tulalip; Umatilla; Walla Walla, Wallawalla; Wasco, Wishram; Wasco, Wishram, Chinook from Warm Springs; Wasco, Wishram, Chinook from Yakama; Yakama, Yakima; Yankton Sioux, Yanktonai",27,32,,2 offsite,Fort Lapwai Sanatorium and Hospital; Fort Lapwai Industrial School,46.395186,-116.802063,TRUE
Fort Totten Indian Industrial School,[Fort Totten Indian Industrial School](https://github.com/washingtonpost/data-boarding-schools/tree/main/schools/ND/Fort_Totten_Indian_Industrial_School),ND,255,1891 - 1959,Catholic,Chippewa; Cree; Sioux; Sisseton Wahpeton Oyate Sioux; Spirit Lake Sioux; Turtle Mountain Band of Chippewa; White Earth Band Chippewa,5,32,,1 offsite,"Whipple Institute; Fort Totten Bonded Industrial School; Tuberculosis Preventorium; Fort
Totten Community School",47.9774617,-98.99456119,TRUE
San Juan Training School,[San Juan Training School](https://github.com/washingtonpost/data-boarding-schools/tree/main/schools/NM/San_Juan_Training_School),NM,229,1906 - 1966,,"Navajo, Navaho, Dine",4,30,,,San Juan Boarding School; San Juan Indian School,36.785179,-108.68911,TRUE
Fort Shaw Government Industrial Indian School,[Fort Shaw Government Industrial Indian School](https://github.com/washingtonpost/data-boarding-schools/tree/main/schools/MT/Fort_Shaw_Government_Industrial_Indian_School),MT,182,1892 - 1910,,"Assiniboine; Blackfeet, Blackfoot; Cheyenne; Chippewa; Colville; Cree; Crow, Absaroka; Flathead Indians; Gros Ventre, Aaniiih; Kalispel; Kootenai from Flathead, Montana; Nez Perce, Idaho; Northern Cheyenne, Montana; Pend d'Oreille, Upper Kalispel; Piegan, Peigan, Pikuni, Piikuni; Shoshone Bannock; Shoshone, Shoshoni, Snake; Sioux; Spokane from Flathead; Yankton Sioux, Yanktonai",1,29,1 onsite,,Fort Shaw Training School; Fort Shaw Boarding School,47.50944127,-111.8199902,TRUE
